{
  "schema_version": "judgment-method-extraction/v2",
  "batch": {
    "batch_id": "BPHS97_ch23_vyaya-bhava_20260821_run02",
    "book_id": "bphs-97",
    "edition_id": "santhanam",
    "artifact_scope": "FORMAL",
    "pilot_only": false,
    "publishable": false,
    "book_strategy": "rule_book",
    "chapter_features": [
      "simple_house_placement"
    ],
    "requested_review": "full",
    "consecutive_clean_batches": 0,
    "review_cycle_position": 1
  },
  "source_scope": [
    "bphs-97:santhanam:ch23:v1-4",
    "bphs-97:santhanam:ch23:v5-6",
    "bphs-97:santhanam:ch23:v7",
    "bphs-97:santhanam:ch23:v8",
    "bphs-97:santhanam:ch23:v9",
    "bphs-97:santhanam:ch23:v10",
    "bphs-97:santhanam:ch23:v11",
    "bphs-97:santhanam:ch23:v12",
    "bphs-97:santhanam:ch23:v13",
    "bphs-97:santhanam:ch23:v14"
  ],
  "source_records": [
    {
      "evidence_atom_id": "bphs-97:santhanam:ch23:v1-4",
      "semantic_class": "condition_result",
      "risk_flags": []
    },
    {
      "evidence_atom_id": "bphs-97:santhanam:ch23:v5-6",
      "semantic_class": "condition_result",
      "risk_flags": []
    },
    {
      "evidence_atom_id": "bphs-97:santhanam:ch23:v7",
      "semantic_class": "foundational_knowledge",
      "risk_flags": [],
      "disposition": "knowledge_only"
    },
    {
      "evidence_atom_id": "bphs-97:santhanam:ch23:v8",
      "semantic_class": "condition_result",
      "risk_flags": []
    },
    {
      "evidence_atom_id": "bphs-97:santhanam:ch23:v9",
      "semantic_class": "condition_result",
      "risk_flags": []
    },
    {
      "evidence_atom_id": "bphs-97:santhanam:ch23:v10",
      "semantic_class": "condition_result",
      "risk_flags": []
    },
    {
      "evidence_atom_id": "bphs-97:santhanam:ch23:v11",
      "semantic_class": "condition_result",
      "risk_flags": []
    },
    {
      "evidence_atom_id": "bphs-97:santhanam:ch23:v12",
      "semantic_class": "condition_result",
      "risk_flags": []
    },
    {
      "evidence_atom_id": "bphs-97:santhanam:ch23:v13",
      "semantic_class": "condition_result",
      "risk_flags": []
    },
    {
      "evidence_atom_id": "bphs-97:santhanam:ch23:v14",
      "semantic_class": "condition_result",
      "risk_flags": []
    }
  ],
  "methods": [
    {
      "method": "ch23-v1-4-good-account-expenses",
      "title": "开支花在好用途上：十二宫主与吉星同宫、落自己主管的宫位或入旺，或十二宫被吉星占据",
      "target_house": 12,
      "generalization_scope": "general_rule",
      "source_status": "single_explicit_source",
      "fact_binding_status": "unmapped",
      "upstream_issue_ids": [],
      "user_intents": [
        "我的钱都花到哪里去了",
        "我这辈子的开销是好是坏"
      ],
      "facts": [
        {
          "key": "本盘十二宫主（Vyaya's Lord）是哪颗行星",
          "availability": "always",
          "role": "context"
        },
        {
          "key": "十二宫主（Vyaya's Lord）是否与吉星同宫",
          "availability": "conditional",
          "role": "evidence_condition"
        },
        {
          "key": "十二宫主（Vyaya's Lord）是否落自己主管的宫位（own Bhava）",
          "availability": "conditional",
          "role": "evidence_condition"
        },
        {
          "key": "十二宫主（Vyaya's Lord）是否入旺",
          "availability": "conditional",
          "role": "evidence_condition"
        },
        {
          "key": "十二宫（Vyaya）是否被吉星占据",
          "availability": "conditional",
          "role": "evidence_condition"
        }
      ],
      "dependencies": [],
      "steps": [
        {
          "action": "先取本盘十二宫主（Vyaya's Lord）是哪颗行星，再逐一核对它是否与吉星同宫、是否落自己主管的宫位、是否入旺，以及十二宫（Vyaya）内是否有吉星。",
          "applicability_scope": "仅限本命盘十二宫（Vyaya Bhava）的开支性质主题；原文只给出四个并列择一条件，未给时间限定，也未给开支的数额或对象。",
          "minimum_supported_claim": "十二宫主（Vyaya's Lord）与吉星同宫，或落自己主管的宫位（own Bhava），或入旺，或者十二宫（Vyaya）被吉星占据时，开支会花在好的用途上。",
          "claim_terms": {
            "conditions": [
              {
                "quote": "Vyaya’s Lord is with a benefic",
                "claim": "十二宫主（Vyaya's Lord）与吉星同宫"
              },
              {
                "quote": "in his own Bhava",
                "claim": "落自己主管的宫位（own Bhava）"
              },
              {
                "quote": "exalted",
                "claim": "入旺"
              },
              {
                "quote": "if a benefic occupies Vyaya",
                "claim": "十二宫（Vyaya）被吉星占据"
              }
            ],
            "results": [
              {
                "quote": "There will be expenses on good accounts",
                "claim": "开支会花在好的用途上"
              }
            ]
          },
          "time_scope": {
            "kind": "none",
            "label": "原文没有时间限定",
            "fact_keys": []
          },
          "produced_fact_keys": [
            "十二宫主状态下的开支性质判定"
          ],
          "required_fact_keys": [
            "本盘十二宫主（Vyaya's Lord）是哪颗行星"
          ],
          "condition_logic": {
            "fact_key": "本盘十二宫主（Vyaya's Lord）是哪颗行星"
          },
          "conditional_requirements": [],
          "alternative_groups": [
            {
              "group_id": "good-expense-condition",
              "branches": [
                {
                  "branch_id": "lord-with-benefic",
                  "condition_logic": {
                    "fact_key": "十二宫主（Vyaya's Lord）是否与吉星同宫"
                  },
                  "required_fact_keys": [
                    "十二宫主（Vyaya's Lord）是否与吉星同宫"
                  ]
                },
                {
                  "branch_id": "lord-own-bhava",
                  "condition_logic": {
                    "fact_key": "十二宫主（Vyaya's Lord）是否落自己主管的宫位（own Bhava）"
                  },
                  "required_fact_keys": [
                    "十二宫主（Vyaya's Lord）是否落自己主管的宫位（own Bhava）"
                  ]
                },
                {
                  "branch_id": "lord-exalted",
                  "condition_logic": {
                    "fact_key": "十二宫主（Vyaya's Lord）是否入旺"
                  },
                  "required_fact_keys": [
                    "十二宫主（Vyaya's Lord）是否入旺"
                  ]
                },
                {
                  "branch_id": "benefic-in-vyaya",
                  "condition_logic": {
                    "fact_key": "十二宫（Vyaya）是否被吉星占据"
                  },
                  "required_fact_keys": [
                    "十二宫（Vyaya）是否被吉星占据"
                  ]
                }
              ]
            }
          ],
          "concession_conditions": [],
          "context_reference": false,
          "context_bindings": [],
          "source_status": "single_explicit_source",
          "evidence": [
            {
              "evidence_atom_id": "bphs-97:santhanam:ch23:v1-4",
              "quote": "There will be expenses on good accounts, if Vyaya’s Lord is with a benefic, or in his own Bhava, or exalted, or, if a benefic occupies Vyaya."
            }
          ],
          "exception_relations": [],
          "forbidden_extensions": [
            "不得据此推断开支的金额、时间或具体项目。",
            "不得把「好的用途」扩大成发财、致富或进项增加。",
            "不得把四个择一条件改写成必须同时成立。"
          ]
        }
      ],
      "retrieval_plan": {
        "support_queries": [
          "There will be expenses on good accounts, if Vyaya’s Lord is with a benefic, or in his own Bhava, or exalted",
          "十二宫主 与吉星同宫 入旺 开支 好的用途"
        ],
        "counter_queries": [
          "If Vyaya’s Lord is in Vyaya Bhava, the native will only face heavy expenditure, will not have physical felicity, be irritable and spiteful.",
          "Earnings will be through sinful measures, if Vyaya is occupied by Shani, or Mangal etc. and is not receiving a Drishti from a benefic.",
          "If Lagn’s Lord is in Vyaya Bhava and is devoid of benefic Drishti and/or Yuti, the native will be bereft of physical happiness, will spend unfruitfully and be given to much anger."
        ],
        "boundary_queries": [
          "Indications of Vyaya Bhava. From Vyaya Bhava, one can know about expenses, history of enemies, one’s own death etc.",
          "Among these, Surya, Shani, Mangal, decreasing Chandra, Rahu and Ketu (the ascending and the descending nodes of Chandra) are malefics, while the rest are benefics",
          "For the seven Grahas, from Surya on, the exaltation Rāśis are, respectively, Mesh, Vrishabh, Makar, Kanya, Kark, Meen and Tula",
          "It is half beneficial in its own Bhava"
        ],
        "method_queries": [
          "Effects of Vyaya’s Lord in Various Bhavas",
          "判断十二宫开支要先看十二宫主与吉星的关系"
        ]
      },
      "stop_conditions": [
        "缺少本盘十二宫主是哪颗行星的事实时停止。",
        "四个择一条件的事实全部缺失时停止。",
        "吉星名册未确定时，与吉星有关的两个分支停止。"
      ],
      "spine_slot_hint": null
    },
    {
      "method": "ch23-v1-4-chandra-vyaya-lord-comforts",
      "title": "房屋床铺与享乐：月亮为十二宫主，且入旺、落本宫本九分盘，或落十一宫、九宫、五宫",
      "target_house": 12,
      "generalization_scope": "general_rule",
      "source_status": "single_explicit_source",
      "fact_binding_status": "unmapped",
      "upstream_issue_ids": [],
      "user_intents": [
        "我住的地方好不好",
        "我这辈子享不享受得到好东西"
      ],
      "facts": [
        {
          "key": "十二宫主（Vyaya's Lord）是否为月亮（Chandra）",
          "availability": "always",
          "role": "evidence_condition"
        },
        {
          "key": "月亮（Chandra）是否入旺",
          "availability": "conditional",
          "role": "evidence_condition"
        },
        {
          "key": "月亮（Chandra）是否落本星座（own Rāśi）",
          "availability": "conditional",
          "role": "evidence_condition"
        },
        {
          "key": "月亮（Chandra）是否落在自己主管的九分盘（Navamsa D9）星座",
          "availability": "conditional",
          "role": "evidence_condition"
        },
        {
          "key": "月亮（Chandra）是否落十一宫（Labh）",
          "availability": "conditional",
          "role": "evidence_condition"
        },
        {
          "key": "月亮（Chandra）是否落九宫（Dharm）",
          "availability": "conditional",
          "role": "evidence_condition"
        },
        {